{
  "schemaVersion": 1,
  "device": {
    "family": "SM8650",
    "abi": "arm64-v8a",
    "sdk": 36,
    "pageSize": 4096
  },
  "source": {
    "projectRevision": "53202d93d474a5f5e881ed23e9c97436d996890e",
    "fexRevision": "f2b679f6028ce1c38875233aecfcf5d3f8ebecec"
  },
  "artifact": {
    "apkSha256": "8e3a840a81f42117ea2fd9cbc178a717021d21fc00b9cc5bcab67d3b6e12e8c9",
    "runnerSha256": "d167de194ea361c2a0b4d92eaf267ef62a9a2fd487219ab05b729c7807fb51e3",
    "elfClass": "ELF64",
    "machine": "AArch64",
    "interpreter": "/lib/ld-linux-aarch64.so.1",
    "needed": [
      "libc.so.6",
      "libgcc_s.so.1",
      "libm.so.6",
      "libstdc++.so.6"
    ]
  },
  "run": {
    "exitCode": 0,
    "durationMs": 1418,
    "marker": "FEXCORE_GUEST_ENGINE_OK revision=f2b679f6028ce1c38875233aecfcf5d3f8ebecec gpr=ok rflags=ok xmm=ok bridge=ok threads=ok tls=ok invalidation=ok teardown=ok",
    "contracts": {
      "gpr": "ok",
      "rflags": "ok",
      "xmm": "ok",
      "bridge": "ok",
      "threads": "ok",
      "tls": "ok",
      "invalidation": "ok",
      "teardown": "ok"
    }
  },
  "logs": {
    "instrumentationSha256": "7c515e72b34c0e0858907a6229c8875cd483ab48dbb66d90131c5a12d34904b6",
    "logcatSha256": "fca05e334268113e9406d5573337e96a76314eb1857ec809e8872e169b5663a6"
  }
}
